{
  "schema_version": "1.1",
  "title": "Quarterly Operations Review",
  "source": "https://fixture.invalid/protected/quarterly-operations-review",
  "pages": [
    {
      "page": 1,
      "pdf_source_page": 1,
      "image": "pages/page-001.png",
      "width": 1275,
      "height": 1650,
      "sha256": "aab5d1a21dddb3b95d047c63bd3970b5bbac2f399330493561391781610bf66d",
      "ocr": {
        "text": "Quarterly Operations Review\nPrepared for the WebShot protected-viewer fixture corpus.\nThis page exists so the protected assembly path can be exercised\nwithout a live document viewer or any tenant data. Every word on\nit was written for this repository.\nSection 1. Recognition sentinel\nSENTINEL PAGE ONE ALPHA\nThe invisible text layer built from this page must contain the\nsentinel above, and the page transcript must report it as well.\nSection 2. Layout\nBody text uses a plain serif-free face at a size that a standard\nTesseract installation reads reliably, so the fixture stays stable\nacross machines and continuous integration runners.\nPage 1 of 2",
        "confidence": 95.96,
        "word_count": 104,
        "language": "eng",
        "engine": "Tesseract",
        "page_segmentation_mode": 11,
        "tsv": "ocr/page-001.tsv",
        "alternate": null,
        "words": [
          {
            "text": "Quarterly",
            "confidence": 95.916847,
            "bbox": [
              112,
              128,
              203,
              43
            ],
            "line": [
              1,
              1,
              1
            ]
          },
          {
            "text": "Operations",
            "confidence": 96.184547,
            "bbox": [
              331,
              128,
              239,
              43
            ],
            "line": [
              1,
              1,
              1
            ]
          },
          {
            "text": "Review",
            "confidence": 96.59874,
            "bbox": [
              589,
              129,
              157,
              33
            ],
            "line": [
              1,
              1,
              1
            ]
          },
          {
            "text": "Prepared",
            "confidence": 96.695412,
            "bbox": [
              112,
              266,
              121,
              28
            ],
            "line": [
              2,
              1,
              1
            ]
          },
          {
            "text": "for",
            "confidence": 96.664322,
            "bbox": [
              243,
              266,
              35,
              22
            ],
            "line": [
              2,
              1,
              1
            ]
          },
          {
            "text": "the",
            "confidence": 92.893356,
            "bbox": [
              286,
              266,
              40,
              22
            ],
            "line": [
              2,
              1,
              1
            ]
          },
          {
            "text": "WebShot",
            "confidence": 91.404373,
            "bbox": [
              336,
              266,
              124,
              22
            ],
            "line": [
              2,
              1,
              1
            ]
          },
          {
            "text": "protected-viewer",
            "confidence": 92.041115,
            "bbox": [
              470,
              266,
              222,
              28
            ],
            "line": [
              2,
              1,
              1
            ]
          },
          {
            "text": "fixture",
            "confidence": 96.634064,
            "bbox": [
              700,
              266,
              80,
              22
            ],
            "line": [
              2,
              1,
              1
            ]
          },
          {
            "text": "corpus.",
            "confidence": 96.283058,
            "bbox": [
              791,
              272,
              96,
              22
            ],
            "line": [
              2,
              1,
              1
            ]
          },
          {
            "text": "This",
            "confidence": 96.247879,
            "bbox": [
              111,
              362,
              55,
              22
            ],
            "line": [
              3,
              1,
              1
            ]
          },
          {
            "text": "page",
            "confidence": 96.506096,
            "bbox": [
              177,
              368,
              64,
              22
            ],
            "line": [
              3,
              1,
              1
            ]
          },
          {
            "text": "exists",
            "confidence": 96.599709,
            "bbox": [
              252,
              362,
              75,
              22
            ],
            "line": [
              3,
              1,
              1
            ]
          },
          {
            "text": "so",
            "confidence": 96.069878,
            "bbox": [
              337,
              368,
              30,
              16
            ],
            "line": [
              3,
              1,
              1
            ]
          },
          {
            "text": "the",
            "confidence": 96.069878,
            "bbox": [
              376,
              362,
              40,
              22
            ],
            "line": [
              3,
              1,
              1
            ]
          },
          {
            "text": "protected",
            "confidence": 96.264313,
            "bbox": [
              428,
              362,
              122,
              28
            ],
            "line": [
              3,
              1,
              1
            ]
          },
          {
            "text": "assembly",
            "confidence": 96.264313,
            "bbox": [
              561,
              362,
              127,
              28
            ],
            "line": [
              3,
              1,
              1
            ]
          },
          {
            "text": "path",
            "confidence": 96.814041,
            "bbox": [
              698,
              362,
              55,
              28
            ],
            "line": [
              3,
              1,
              1
            ]
          },
          {
            "text": "can",
            "confidence": 95.541817,
            "bbox": [
              764,
              368,
              46,
              16
            ],
            "line": [
              3,
              1,
              1
            ]
          },
          {
            "text": "be",
            "confidence": 96.261917,
            "bbox": [
              822,
              362,
              30,
              22
            ],
            "line": [
              3,
              1,
              1
            ]
          },
          {
            "text": "exercised",
            "confidence": 96.008629,
            "bbox": [
              863,
              362,
              127,
              22
            ],
            "line": [
              3,
              1,
              1
            ]
          },
          {
            "text": "without",
            "confidence": 96.714943,
            "bbox": [
              110,
              410,
              96,
              22
            ],
            "line": [
              4,
              1,
              1
            ]
          },
          {
            "text": "a",
            "confidence": 96.75547,
            "bbox": [
              215,
              416,
              14,
              16
            ],
            "line": [
              4,
              1,
              1
            ]
          },
          {
            "text": "live",
            "confidence": 96.75547,
            "bbox": [
              241,
              410,
              42,
              22
            ],
            "line": [
              4,
              1,
              1
            ]
          },
          {
            "text": "document",
            "confidence": 96.015503,
            "bbox": [
              294,
              410,
              132,
              22
            ],
            "line": [
              4,
              1,
              1
            ]
          },
          {
            "text": "viewer",
            "confidence": 96.328285,
            "bbox": [
              434,
              410,
              88,
              22
            ],
            "line": [
              4,
              1,
              1
            ]
          },
          {
            "text": "or",
            "confidence": 96.347763,
            "bbox": [
              531,
              416,
              26,
              16
            ],
            "line": [
              4,
              1,
              1
            ]
          },
          {
            "text": "any",
            "confidence": 96.347763,
            "bbox": [
              566,
              416,
              48,
              22
            ],
            "line": [
              4,
              1,
              1
            ]
          },
          {
            "text": "tenant",
            "confidence": 96.516823,
            "bbox": [
              622,
              411,
              84,
              21
            ],
            "line": [
              4,
              1,
              1
            ]
          },
          {
            "text": "data.",
            "confidence": 96.516823,
            "bbox": [
              715,
              410,
              64,
              22
            ],
            "line": [
              4,
              1,
              1
            ]
          },
          {
            "text": "Every",